{
  "$schema": "https://json-schema.org/draft/2020-12/schema",
  "$id": "https://civic-issue-tracker.local/contracts/openapi/problem.v1.schema.json",
  "title": "ProblemDetailsV1",
  "type": "object",
  "additionalProperties": false,
  "required": [
    "type",
    "title",
    "status",
    "code",
    "correlationId"
  ],
  "properties": {
    "type": {
      "type": "string",
      "format": "uri"
    },
    "title": {
      "type": "string"
    },
    "status": {
      "type": "integer",
      "minimum": 100,
      "maximum": 599
    },
    "detail": {
      "type": "string"
    },
    "instance": {
      "type": "string",
      "format": "uri-reference"
    },
    "code": {
      "type": "string"
    },
    "correlationId": {
      "type": "string",
      "format": "uuid"
    },
    "errors": {
      "type": "array",
      "items": {
        "type": "object",
        "additionalProperties": false,
        "required": [
          "field",
          "message"
        ],
        "properties": {
          "field": {
            "type": "string"
          },
          "message": {
            "type": "string"
          }
        }
      }
    }
  }
}
